ticket_id,description,category,severity,resolution,resolution_cluster,user_tier,department,auto_resolved,verified,created_at
INC-10256,"Hi team, my account got locked and i cannot login to any systems",Auth/SSO,P3,Unlock user account in Active Directory,account_unlock,standard,Procurement,True,True,2025-04-13T00:00:00Z
INC-10257,printer driver missing from laptop after refresh by IT urgent,Printer Issues,P3,Reinstall or update printer driver,printer_driver_install,contractor,Logistics,True,True,2025-06-27T00:00:00Z
INC-10258,randomly getting signed out via SSO multiple times daily,Auth/SSO,P3,Reset user password via LDAP / Active Directory,password_reset,standard,Marketing,False,True,2025-05-15T00:00:00Z
INC-10259,SAP account deactivated after leave period need reactivation,SAP Issues,P4,Reset SAP credentials and clear session cache,sap_credential_reset,contractor,Marketing,True,True,2025-06-11T00:00:00Z
INC-10260,urgent - network adapter needs driver update wifi keeps cutting out,Network/Connectivity,P3,Update network adapter driver,network_driver_update,standard,HR,True,True,2025-10-05T00:00:00Z
INC-10261,inbox rules have stopped working emails not being sorted urgent,Email Access,P3,Remove conflicting email rules or corrupted filters,email_rule_fix,standard,Legal,True,True,2025-08-24T00:00:00Z
INC-10262,"Hi team, SAP application crashing for all users on our floor",SAP Issues,P3,Restart SAP application service and clear job queue,sap_service_restart,standard,HR,True,True,2025-10-12T00:00:00Z
INC-10263,network adapter driver issues causing constant disconnections urgent,Network/Connectivity,P3,Update network adapter driver,network_driver_update,standard,Legal,True,True,2025-03-19T00:00:00Z
INC-10264,getting certificate not trusted error when connecting to vpn,VPN Problems,P3,Renew or reinstall VPN certificate,vpn_cert_renew,standard,Engineering,True,True,2025-01-14T00:00:00Z
INC-10265,SAP credential error appearing on every login attempt,SAP Issues,P3,Reset SAP credentials and clear session cache,sap_credential_reset,standard,Finance,True,True,2025-11-29T00:00:00Z
INC-10266,entire warehouse offline barcode scanners not working,Network/Connectivity,P1,Enable network port on switch for user device,network_port_enable,standard,Procurement,False,True,2025-10-26T00:00:00Z
INC-10267,lost access to my authenticator app cannot login anywhere,Auth/SSO,P3,Reconfigure or reset MFA / 2FA device,mfa_reconfigure,contractor,Finance,True,True,2025-02-24T00:00:00Z
INC-10268,laptop wireless keeps going offline needs driver update,Network/Connectivity,P3,Update network adapter driver,network_driver_update,standard,Marketing,True,True,2025-03-02T00:00:00Z
INC-10269,access to legacy system needed for compliance audit purposes,Permissions/Access,P3,Assign correct role or group membership in AD,permission_role_assign,contractor,Legal,True,True,2025-12-09T00:00:00Z
INC-10270,intermittent connectivity issues occurring throughout day,Network/Connectivity,P3,Enable network port on switch for user device,network_port_enable,standard,Logistics,False,True,2026-01-22T00:00:00Z
INC-10271,applications keep asking to login again SSO not holding session asap,Auth/SSO,P3,Clear SSO token cache and force re-authentication,sso_token_refresh,standard,Operations,True,True,2025-11-07T00:00:00Z
INC-10272,email quota maxed out causing delivery failures for me,Email Access,P3,Clear mailbox quota and archive old emails,email_quota_fix,standard,Operations,True,True,2025-06-17T00:00:00Z
INC-10273,my windows credentials have expired cannot get past login urgent,Auth/SSO,P3,Reset user password via LDAP / Active Directory,password_reset,standard,Logistics,True,True,2025-10-11T00:00:00Z
INC-10274,SSO logging me out frequently from all internal applications,Auth/SSO,P3,Clear SSO token cache and force re-authentication,sso_token_refresh,standard,Procurement,False,True,2025-12-31T00:00:00Z
INC-10275,spam filter blocking legitimate emails from colleagues,Email Access,P3,Remove conflicting email rules or corrupted filters,email_rule_fix,standard,HR,True,True,2025-07-01T00:00:00Z
INC-10276,office 365 apps displaying unlicensed product banner constantly,Software Install,P3,Assign or reactivate software license for user,software_license_assign,standard,Operations,True,True,2025-04-08T00:00:00Z
INC-10277,urgent - license server unreachable for engineering software today,Software Install,P3,Assign or reactivate software license for user,software_license_assign,standard,HR,True,True,2025-05-22T00:00:00Z
INC-10278,vpn connected but cannot access intranet or internal apps please help,VPN Problems,P3,Push updated VPN configuration to user device,vpn_config_push,standard,Marketing,True,True,2025-05-02T00:00:00Z
INC-10279,SAP password has expired need to reset SAP credentials,SAP Issues,P4,Reset SAP credentials and clear session cache,sap_credential_reset,standard,Engineering,True,True,2025-04-04T00:00:00Z
INC-10280,vpn authentication failing certificate has passed expiry date,VPN Problems,P3,Renew or reinstall VPN certificate,vpn_cert_renew,standard,Legal,True,True,2025-02-17T00:00:00Z
INC-10281,email rule conflicting causing incorrect sorting of messages,Email Access,P3,Remove conflicting email rules or corrupted filters,email_rule_fix,standard,HR,True,True,2025-08-25T00:00:00Z
INC-10282,"Hi team, spooler service needs restart print queue completely jammed",Printer Issues,P3,Clear stuck print queue and restart spooler service,printer_queue_clear,standard,Logistics,True,True,2025-07-21T00:00:00Z
INC-10283,no internet access at my desk since moving here this morning,Network/Connectivity,P3,Enable network port on switch for user device,network_port_enable,standard,Operations,True,True,2025-01-27T00:00:00Z
INC-10284,account deactivated after incorrect password attempts repeatedly asap,Auth/SSO,P3,Unlock user account in Active Directory,account_unlock,standard,HR,True,True,2025-08-02T00:00:00Z
INC-10285,dns lookup failing for many websites cannot browse normally,Network/Connectivity,P3,Flush DNS cache and renew IP address,network_dns_flush,standard,Sales,True,True,2026-01-18T00:00:00Z
INC-10286,email storage limit reached need mailbox quota increased,Email Access,P3,Clear mailbox quota and archive old emails,email_quota_fix,standard,HR,True,True,2025-03-21T00:00:00Z
INC-10287,vpn connection active but internal network unreachable,VPN Problems,P3,Push updated VPN configuration to user device,vpn_config_push,standard,Legal,True,True,2025-05-06T00:00:00Z
INC-10288,USB ports blocked by company policy need exception granted,Permissions/Access,P3,Fix Group Policy Object causing access denial,permission_policy_fix,standard,Marketing,True,True,2025-05-17T00:00:00Z
INC-10289,network unstable keeps going up and down randomly,Network/Connectivity,P3,Update network adapter driver,network_driver_update,standard,Marketing,False,True,2025-07-30T00:00:00Z
INC-10290,two factor auth broken my old phone is gone,Auth/SSO,P3,Reconfigure or reset MFA / 2FA device,mfa_reconfigure,standard,Engineering,True,True,2025-11-27T00:00:00Z
INC-10291,urgent - printer spooler stuck print queue needs to be cleared,Printer Issues,P4,Clear stuck print queue and restart spooler service,printer_queue_clear,standard,Logistics,True,True,2025-10-09T00:00:00Z
INC-10292,printer shows offline on network even though it is powered on,Printer Issues,P3,Re-map network printer and verify IP address,printer_network_map,standard,Marketing,True,True,2025-02-26T00:00:00Z
INC-10293,"Hi team, file share access broken after recent server maintenance",Permissions/Access,P3,Grant folder/share access permissions in AD,permission_folder,contractor,Finance,True,True,2025-06-22T00:00:00Z
INC-10294,two step verification codes not working after phone replacement asap,Auth/SSO,P3,Reconfigure or reset MFA / 2FA device,mfa_reconfigure,contractor,Logistics,True,True,2025-04-30T00:00:00Z
INC-10295,urgent - printer not working correctly need driver to be reinstalled,Printer Issues,P3,Reinstall or update printer driver,printer_driver_install,standard,Procurement,True,True,2025-08-07T00:00:00Z
INC-10296,software update failed and now application is broken,Software Install,P3,Uninstall and clean reinstall application,software_reinstall,standard,Legal,True,True,2026-01-17T00:00:00Z
INC-10297,microsoft office license not assigned after role changed please help,Software Install,P3,Assign or reactivate software license for user,software_license_assign,standard,Finance,True,True,2025-02-22T00:00:00Z
INC-10298,install wizard failing at elevation step admin rights needed,Software Install,P3,Run installer with elevated admin privileges,software_admin_install,standard,Procurement,True,True,2025-02-18T00:00:00Z
INC-10299,emails bouncing because my mailbox storage is completely full,Email Access,P3,Clear mailbox quota and archive old emails,email_quota_fix,standard,Operations,True,True,2025-03-10T00:00:00Z
INC-10300,getting logged out of all applications right after SSO login,Auth/SSO,P3,Clear SSO token cache and force re-authentication,sso_token_refresh,standard,Logistics,True,True,2026-01-02T00:00:00Z
INC-10301,SAP authorisation denied for transaction code i need daily,SAP Issues,P3,Reassign or repair SAP user role permissions,sap_role_assign,standard,IT,True,True,2025-11-26T00:00:00Z
INC-10302,storage quota reached emails not being delivered to me,Email Access,P4,Clear mailbox quota and archive old emails,email_quota_fix,standard,IT,True,True,2025-09-25T00:00:00Z
INC-10303,SAP account locked after failed login attempts,SAP Issues,P3,Reset SAP credentials and clear session cache,sap_credential_reset,standard,IT,True,True,2025-06-25T00:00:00Z
INC-10304,network port needs enabling for newly assigned desk asap,Network/Connectivity,P3,Enable network port on switch for user device,network_port_enable,standard,Logistics,True,True,2025-03-28T00:00:00Z
INC-10305,"Hi team, cannot see network printer in devices list needs remapping",Printer Issues,P3,Re-map network printer and verify IP address,printer_network_map,standard,HR,True,True,2025-12-13T00:00:00Z
INC-10306,new office location desk has inactive network port,Network/Connectivity,P3,Enable network port on switch for user device,network_port_enable,standard,Finance,True,True,2025-02-11T00:00:00Z
INC-10307,vpn refusing connection because certificate is no longer valid,VPN Problems,P4,Renew or reinstall VPN certificate,vpn_cert_renew,standard,Marketing,True,True,2025-05-04T00:00:00Z
INC-10308,urgent - cannot open shared files access permission not granted,Permissions/Access,P4,Grant folder/share access permissions in AD,permission_folder,contractor,Legal,True,True,2025-01-21T00:00:00Z
INC-10309,urgent - account locked out need to unlock immediately for access,Auth/SSO,P3,Unlock user account in Active Directory,account_unlock,standard,Marketing,True,True,2025-10-08T00:00:00Z
INC-10310,websites not loading even though network says connected,Network/Connectivity,P3,Flush DNS cache and renew IP address,network_dns_flush,standard,HR,True,True,2025-04-30T00:00:00Z
INC-10311,policy preventing copy and paste in virtual desktop environment please help,Permissions/Access,P4,Fix Group Policy Object causing access denial,permission_policy_fix,standard,Operations,True,True,2025-10-19T00:00:00Z
INC-10312,bitlocker policy forcing encryption but user needs exemption,Permissions/Access,P3,Fix Group Policy Object causing access denial,permission_policy_fix,standard,Operations,True,True,2025-02-15T00:00:00Z
INC-10313,SAP system not loading after this mornings patch update asap,SAP Issues,P3,Restart SAP application service and clear job queue,sap_service_restart,standard,Legal,True,True,2025-04-19T00:00:00Z
INC-10314,ethernet port at assigned desk not enabled need activation,Network/Connectivity,P3,Enable network port on switch for user device,network_port_enable,standard,Legal,True,True,2025-08-14T00:00:00Z
INC-10315,vpn client showing error after automatic update was applied please help,VPN Problems,P3,Uninstall and reinstall VPN client software,vpn_client_reinstall,standard,Sales,True,True,2025-10-02T00:00:00Z
INC-10316,my SAP user credentials stopped working need reset,SAP Issues,P3,Reset SAP credentials and clear session cache,sap_credential_reset,standard,IT,True,True,2025-07-23T00:00:00Z
INC-10317,network sometimes works sometimes doesnt no clear cause,Network/Connectivity,P3,Enable network port on switch for user device,network_port_enable,standard,Legal,False,True,2025-07-04T00:00:00Z
INC-10318,single sign on session times out very quickly after logging in,Auth/SSO,P3,Clear SSO token cache and force re-authentication,sso_token_refresh,standard,Sales,True,True,2025-04-29T00:00:00Z
INC-10319,vpn connected yet cannot reach internal servers or shares,VPN Problems,P3,Push updated VPN configuration to user device,vpn_config_push,standard,Operations,True,True,2025-10-30T00:00:00Z
INC-10320,vpn showing green but cannot connect to any internal resources urgent,VPN Problems,P3,Push updated VPN configuration to user device,vpn_config_push,standard,Operations,True,True,2025-11-08T00:00:00Z
INC-10321,urgent - colour printer printing only in black and white driver issue,Printer Issues,P4,Reinstall or update printer driver,printer_driver_install,standard,HR,True,True,2025-04-08T00:00:00Z
INC-10322,whole remote team cannot connect to vpn since 8am,VPN Problems,P2,Push updated VPN configuration to user device,vpn_config_push,standard,Legal,False,True,2025-02-08T00:00:00Z
INC-10323,email rules disappeared after recent outlook update,Email Access,P3,Remove conflicting email rules or corrupted filters,email_rule_fix,standard,IT,True,True,2025-03-16T00:00:00Z
INC-10324,mailbox is completely full and i cannot receive any new emails,Email Access,P3,Clear mailbox quota and archive old emails,email_quota_fix,standard,Marketing,True,True,2025-10-14T00:00:00Z
INC-10325,cannot access SAP system credentials are not being accepted asap,SAP Issues,P3,Reset SAP credentials and clear session cache,sap_credential_reset,standard,Legal,True,True,2025-10-24T00:00:00Z
INC-10326,sent items show delivered but recipients say nothing arrived,Email Access,P3,Rebuild or repair Outlook profile,email_profile_repair,standard,HR,False,True,2025-11-08T00:00:00Z
INC-10327,SAP permissions incorrect cannot run required transactions,SAP Issues,P3,Reassign or repair SAP user role permissions,sap_role_assign,standard,IT,True,True,2025-12-08T00:00:00Z
INC-10328,moved to new workstation and there is no network connection,Network/Connectivity,P3,Enable network port on switch for user device,network_port_enable,standard,IT,True,True,2025-09-15T00:00:00Z
INC-10329,"Hi team, SAP transaction blocked with authorisation object missing error",SAP Issues,P3,Reassign or repair SAP user role permissions,sap_role_assign,standard,IT,True,True,2025-12-26T00:00:00Z
INC-10330,application compatibility error appearing on windows 11,Software Install,P3,Uninstall and clean reinstall application,software_reinstall,standard,IT,True,True,2025-03-08T00:00:00Z
INC-10331,urgent - storage quota reached emails not being delivered to me,Email Access,P3,Clear mailbox quota and archive old emails,email_quota_fix,standard,IT,True,True,2025-12-16T00:00:00Z
INC-10332,urgent - MFA authenticator app stopped working after i changed phones,Auth/SSO,P3,Reconfigure or reset MFA / 2FA device,mfa_reconfigure,standard,Engineering,True,True,2025-03-11T00:00:00Z
INC-10333,connected to vpn but internal systems still not reachable,VPN Problems,P4,Push updated VPN configuration to user device,vpn_config_push,standard,HR,True,True,2025-03-07T00:00:00Z
INC-10334,outlook showing mailbox full error cannot send or receive,Email Access,P3,Clear mailbox quota and archive old emails,email_quota_fix,contractor,HR,True,True,2026-01-07T00:00:00Z
INC-10335,application install blocked by applocker group policy,Software Install,P3,Run installer with elevated admin privileges,software_admin_install,contractor,IT,True,True,2026-01-26T00:00:00Z
INC-10336,cannot connect to vpn certificate validity has expired,VPN Problems,P3,Renew or reinstall VPN certificate,vpn_cert_renew,standard,Legal,True,True,2025-05-03T00:00:00Z
INC-10337,"Hi team, shared folder permissions removed without any notification",Permissions/Access,P3,Grant folder/share access permissions in AD,permission_folder,standard,Legal,True,True,2025-05-18T00:00:00Z
INC-10338,urgent - laptop wireless keeps going offline needs driver update,Network/Connectivity,P3,Update network adapter driver,network_driver_update,contractor,Marketing,True,True,2025-04-25T00:00:00Z
INC-10339,wifi keeps disconnecting every few minutes on my laptop,Network/Connectivity,P3,Update network adapter driver,network_driver_update,standard,Engineering,True,True,2025-09-07T00:00:00Z
INC-10340,print queue not processing jobs stuck at pending status,Printer Issues,P3,Clear stuck print queue and restart spooler service,printer_queue_clear,standard,Logistics,True,True,2025-04-11T00:00:00Z
INC-10341,"Hi team, cannot activate windows on new laptop shows license error",Software Install,P3,Assign or reactivate software license for user,software_license_assign,standard,Logistics,True,True,2025-07-31T00:00:00Z
INC-10342,"Hi team, vpn connected but remote desktop to office machines failing",VPN Problems,P3,Push updated VPN configuration to user device,vpn_config_push,standard,Marketing,True,True,2025-06-10T00:00:00Z
INC-10343,SAP authorisation denied for transaction code i need daily,SAP Issues,P3,Reassign or repair SAP user role permissions,sap_role_assign,standard,Engineering,True,True,2026-01-11T00:00:00Z
INC-10344,adobe acrobat crashes immediately every time i launch it,Software Install,P3,Uninstall and clean reinstall application,software_reinstall,standard,Marketing,True,True,2026-01-20T00:00:00Z
INC-10345,new laptop cannot setup outlook showing profile error please help,Email Access,P3,Rebuild or repair Outlook profile,email_profile_repair,contractor,IT,True,True,2025-11-12T00:00:00Z
INC-10346,SSO session expires immediately after successful authentication urgent,Auth/SSO,P3,Clear SSO token cache and force re-authentication,sso_token_refresh,standard,Procurement,True,True,2025-03-22T00:00:00Z
INC-10347,access to legacy system needed for compliance audit purposes,Permissions/Access,P3,Assign correct role or group membership in AD,permission_role_assign,standard,Logistics,True,True,2025-09-12T00:00:00Z
INC-10348,outlook profile corrupted need to rebuild from scratch,Email Access,P3,Rebuild or repair Outlook profile,email_profile_repair,standard,Sales,True,True,2025-08-08T00:00:00Z
INC-10349,wrong cost centre assigned in SAP user profile need correction,SAP Issues,P3,Reassign or repair SAP user role permissions,sap_role_assign,standard,Marketing,True,True,2025-06-01T00:00:00Z
INC-10350,mailbox quota exceeded cannot send or receive emails now urgent,Email Access,P4,Clear mailbox quota and archive old emails,email_quota_fix,contractor,Procurement,True,True,2025-01-07T00:00:00Z
INC-10351,SSO token keeps expiring causing repeated login prompts,Auth/SSO,P3,Clear SSO token cache and force re-authentication,sso_token_refresh,standard,IT,True,True,2026-01-20T00:00:00Z
INC-10352,application crashing with memory error on startup,Software Install,P3,Uninstall and clean reinstall application,software_reinstall,contractor,Finance,True,True,2025-04-02T00:00:00Z
INC-10353,firewall policy blocking approved internal application ports,Permissions/Access,P3,Fix Group Policy Object causing access denial,permission_policy_fix,standard,HR,True,True,2025-02-09T00:00:00Z
INC-10354,connected to vpn but internal systems still not reachable,VPN Problems,P3,Push updated VPN configuration to user device,vpn_config_push,standard,Sales,True,True,2025-12-07T00:00:00Z
INC-10355,"Hi team, google authenticator codes rejected after setting up new device",Auth/SSO,P3,Reconfigure or reset MFA / 2FA device,mfa_reconfigure,standard,Logistics,True,True,2025-11-13T00:00:00Z
INC-10356,vpn application failing to start after windows 11 upgrade,VPN Problems,P3,Uninstall and reinstall VPN client software,vpn_client_reinstall,contractor,Finance,True,True,2025-10-05T00:00:00Z
INC-10357,network cable plugged in but port is not activated yet,Network/Connectivity,P3,Enable network port on switch for user device,network_port_enable,standard,Engineering,True,True,2025-07-19T00:00:00Z
INC-10358,having trouble reaching certain websites dns possibly broken asap,Network/Connectivity,P3,Flush DNS cache and renew IP address,network_dns_flush,standard,Legal,True,True,2025-11-04T00:00:00Z
INC-10359,SAP down for finance during month end close critical,SAP Issues,P1,Restart SAP application service and clear job queue,sap_service_restart,standard,Marketing,False,True,2025-11-07T00:00:00Z
INC-10360,SAP role assignment incorrect after department restructure,SAP Issues,P3,Reassign or repair SAP user role permissions,sap_role_assign,standard,Marketing,True,True,2025-07-02T00:00:00Z
INC-10361,floor printer disappeared from network after office relocation,Printer Issues,P3,Re-map network printer and verify IP address,printer_network_map,standard,HR,True,True,2026-01-30T00:00:00Z
INC-10362,cannot log into SAP system password not accepted,SAP Issues,P3,Reset SAP credentials and clear session cache,sap_credential_reset,standard,Logistics,True,True,2025-02-15T00:00:00Z
INC-10363,some users can print to shared printer others cannot at all,Printer Issues,P3,Reinstall or update printer driver,printer_driver_install,standard,Marketing,False,True,2025-10-20T00:00:00Z
INC-10364,cant find network printer after moving to a different floor,Printer Issues,P3,Re-map network printer and verify IP address,printer_network_map,standard,Logistics,True,True,2025-05-09T00:00:00Z
INC-10365,vpn certificate has expired and i cant connect to office,VPN Problems,P3,Renew or reinstall VPN certificate,vpn_cert_renew,standard,IT,True,True,2025-02-20T00:00:00Z
INC-10366,need MFA reconfiguration after phone was replaced urgent,Auth/SSO,P3,Reconfigure or reset MFA / 2FA device,mfa_reconfigure,contractor,Engineering,True,True,2025-06-16T00:00:00Z
INC-10367,"Hi team, login failing because password expired this morning",Auth/SSO,P3,Reset user password via LDAP / Active Directory,password_reset,standard,IT,True,True,2025-09-23T00:00:00Z
INC-10368,new desk has no network ethernet port is not active,Network/Connectivity,P3,Enable network port on switch for user device,network_port_enable,standard,Legal,True,True,2025-05-03T00:00:00Z
INC-10369,folder access rights incorrect after department restructure,Permissions/Access,P3,Grant folder/share access permissions in AD,permission_folder,standard,Engineering,True,True,2025-11-11T00:00:00Z
INC-10370,cannot access external websites but internal systems work asap,Network/Connectivity,P3,Flush DNS cache and renew IP address,network_dns_flush,standard,Procurement,True,True,2026-01-17T00:00:00Z
INC-10371,distribution list emails bouncing cannot send to group,Email Access,P3,Remove conflicting email rules or corrupted filters,email_rule_fix,standard,Legal,True,True,2025-12-06T00:00:00Z
INC-10372,emails bouncing because my mailbox storage is completely full please help,Email Access,P3,Clear mailbox quota and archive old emails,email_quota_fix,contractor,Sales,True,True,2025-07-08T00:00:00Z
INC-10373,software center application failing to install access denied,Software Install,P3,Run installer with elevated admin privileges,software_admin_install,standard,Finance,True,True,2025-08-10T00:00:00Z
INC-10374,screen lock policy too aggressive locking every two minutes,Permissions/Access,P4,Fix Group Policy Object causing access denial,permission_policy_fix,contractor,Operations,True,True,2025-08-18T00:00:00Z
INC-10375,printer spooler stuck print queue needs to be cleared,Printer Issues,P3,Clear stuck print queue and restart spooler service,printer_queue_clear,standard,Legal,True,True,2025-03-07T00:00:00Z
INC-10376,vpn shows connected but internal file shares not accessible,VPN Problems,P4,Push updated VPN configuration to user device,vpn_config_push,standard,Operations,True,True,2025-11-19T00:00:00Z
INC-10377,cannot access shared drive folder getting access denied error please help,Permissions/Access,P3,Grant folder/share access permissions in AD,permission_folder,standard,Finance,True,True,2025-03-22T00:00:00Z
INC-10378,vpn says connected but no internal services are accessible asap,VPN Problems,P3,Push updated VPN configuration to user device,vpn_config_push,standard,Logistics,True,True,2025-12-15T00:00:00Z
INC-10379,switched desks and now have zero network connectivity please help,Network/Connectivity,P3,Enable network port on switch for user device,network_port_enable,standard,Procurement,True,True,2025-04-02T00:00:00Z
INC-10380,stuck print queue large number of jobs not being processed urgent,Printer Issues,P3,Clear stuck print queue and restart spooler service,printer_queue_clear,standard,Logistics,True,True,2025-07-06T00:00:00Z
INC-10381,outlook not opening at all it crashes immediately on startup please help,Email Access,P3,Rebuild or repair Outlook profile,email_profile_repair,standard,HR,True,True,2025-10-15T00:00:00Z
INC-10382,windows password expired please reset my credentials asap,Auth/SSO,P3,Reset user password via LDAP / Active Directory,password_reset,standard,Sales,True,True,2026-01-28T00:00:00Z
INC-10383,email client not working after windows was rebuilt on laptop,Email Access,P3,Rebuild or repair Outlook profile,email_profile_repair,standard,Sales,True,True,2025-09-21T00:00:00Z
INC-10384,SAP HR module blocked for entire HR team after upgrade,SAP Issues,P2,Reassign or repair SAP user role permissions,sap_role_assign,standard,Procurement,False,True,2025-09-25T00:00:00Z
